date,headline,ticker,source
2023-11-14,SPY faces regulatory scrutiny over business practices,SPY,Bloomberg
2023-11-14,Mixed signals for SPY as sector consolidates,SPY,Yahoo Finance
2023-11-15,MSFT expands into new market with strategic acquisition,MSFT,Reuters
2023-11-15,MSFT cloud revenue growth accelerates in latest quarter,MSFT,CNBC
2023-11-16,GOOGL raises full-year guidance above consensus,GOOGL,Yahoo Finance
2023-11-17,MSFT volume picks up ahead of next week earnings,MSFT,Reuters
2023-11-20,SPY layoffs signal deeper problems in core business,SPY,Bloomberg
2023-11-20,"AAPL beats earnings expectations, shares surge",AAPL,Yahoo Finance
2023-11-21,AAPL reports record revenue in Q2 results,AAPL,CNBC
2023-11-21,Trading volume in SPY remains steady ahead of earnings,SPY,Bloomberg
2023-11-23,Strong consumer demand drives GOOGL sales higher,GOOGL,Yahoo Finance
2023-11-27,QQQ files routine regulatory paperwork,QQQ,Reuters
2023-11-27,"SPY misses revenue estimates, stock drops",SPY,Reuters
2023-11-28,MSFT to present at upcoming investor conference,MSFT,Bloomberg
2023-11-29,QQQ warns of supply chain disruptions impacting margins,QQQ,Yahoo Finance
2023-11-29,GOOGL expands into new market with strategic acquisition,GOOGL,Reuters
2023-11-30,AAPL reports results in line with expectations,AAPL,CNBC
2023-11-30,Concerns mount over AAPL slowing growth trajectory,AAPL,Reuters
2023-12-01,SPY reports record revenue in Q2 results,SPY,Reuters
2023-12-01,Rising costs pressure AAPL profit margins,AAPL,CNBC
2023-12-04,SPY volume picks up ahead of next week earnings,SPY,CNBC
2023-12-05,MSFT layoffs signal deeper problems in core business,MSFT,Yahoo Finance
2023-12-06,Analysts maintain hold rating on GOOGL,GOOGL,Reuters
2023-12-06,MSFT lowers guidance amid macroeconomic headwinds,MSFT,Reuters
2023-12-06,Sector rotation leaves SPY flat on the day,SPY,CNBC
2023-12-07,Sector rotation leaves AAPL flat on the day,AAPL,Bloomberg
2023-12-07,SPY hit by data breach affecting millions of users,SPY,Yahoo Finance
2023-12-08,Treasury yields climb as inflation data tops expectations,,Bloomberg
2023-12-13,Central banks globally signal tightening monetary policy,,CNBC
2023-12-13,Small caps outperform as risk appetite improves,,Reuters
2023-12-14,Competition intensifies as SPY loses market share,SPY,MarketWatch
2023-12-19,Short sellers increase bets against GOOGL,GOOGL,MarketWatch
2023-12-19,Trade tensions weigh on QQQ international revenue,QQQ,Bloomberg
2023-12-19,MSFT reports record revenue in Q1 results,MSFT,MarketWatch
2023-12-20,GOOGL board approves routine corporate matters,GOOGL,Yahoo Finance
2023-12-21,GDP growth slows but beats revised expectations,,Reuters
2023-12-21,Trading volume in QQQ remains steady ahead of earnings,QQQ,Reuters
2023-12-26,S&P 500 closes at session highs on broad rally,,CNBC
2023-12-27,Concerns mount over MSFT slowing growth trajectory,MSFT,Reuters
2023-12-27,GOOGL CFO departure raises governance questions,GOOGL,Bloomberg
2023-12-28,SPY cloud revenue growth accelerates in latest quarter,SPY,CNBC
2023-12-28,Central banks globally signal tightening monetary policy,,CNBC
2023-12-28,AAPL trading near 50-day moving average,AAPL,MarketWatch
2023-12-29,SPY layoffs signal deeper problems in core business,SPY,Yahoo Finance
